1904	Пламя любви	(Филлипс Патриция)	Пламя любви зажглось для прекрасной леди Элинор Десмонд и отважного сэра Джордана де Вера в час, когда мужественный рыцарь спас беззащитную девушку из рук разбойников. И не было в мире силы, способной погасить это пламя. Ни годы разлуки, ни смертельно опасные приключения, ни, наконец, сама судьба, снова и снова разлучавшая влюбленных, - ничто не могло заставить Элинор и Джордана позабыть безумную страсть, ставшую для них мукой и радостью, бедой и счастьем, смыслом и сутью жизни.....		
2469	Сладкий дикий рай	(Грэм Хизер (Хедер))	Прекрасная Джесси Дюпре возненавидела лорда Джеймса Камерона с первой же встречи... хотя именно этот циничный человек оказался единственным, кто протянул ей, нищей сироте, руку помощи. Джесси поклялась никогда не принадлежать Джеймсу, однако чем дальше, тем труднее было юной, неопытной девушке устоять перед магической притягательностью настоящего мужчины, властно манившего ее в неведомый мир безумной страсти...		
2470	Услада пирата	(Грэм Хизер (Хедер))	Лихой пиратский капитан по прозвищу Серебряный Ястреб спас прекрасную леди Скай Кинсдейл от верной гибели, но сделал ее своей пленницей. Покоренная магической притягательностью мужественного пирата, красавица из последних сил пыталась призвать на помощь чувство долга и сохранить верность человеку, в жены которому предназначена была с колыбели. Однако, пылая в огне безумной страсти, Скай даже не подозревала, что благодаря капризу судьбы стала пленницей своего будущего супруга...		
2999	Обольщение	(Квик Аманда)	Неискушенная провинциалка Софи выходит замуж за баснословно богатого, но высокомерного, окутанного мрачными тайнами, разочарованного в женщинах графа Рейвенвуда. Как в такой ситуации поступит молодая жена: согласится на роль покорной рабыни, начнет жить в свое удовольствие или попытается пробудить в муже любовь и нежность?		
2928	Повеса	(Патни Мэри Джо)	Родня беспутного повесы Реджинальда Дэвенпорта надеялась, что, став владельцем процветающего поместья, он откажется от прежнего образа жизни и образумится. Леди Элис Уэстон, решительная молодая женщина, переодевшись мужчиной, чтобы занять должность управляющего поместьем, стремится укрыться от несправедливости и фальши, с которыми не может мириться. Ни Реджинальд, ни Элис еще не знают, что встреча не просто изменит их жизнь, но и откроет им новый, ослепительно прекрасный мир истинной, всепоглощающей любви…		
1500	Шелковые узы	(Райан Нэн)	Миссисипи. Река, пересекающая штаты и соединяющая сердца. Река, подарившая циничному игроку Джонни Роулетту неожиданную встречу с юной, невинной Невадой Гамильтон, вынужденной зарабатывать на жизнь пением в варьете. Река, которая помогла однажды неотразимому соблазнителю стать пылким возлюбленным, а недоверчивой красотке - обрести долгожданное счастье...		
1964	Непокорный ангел	(Фэйзер Джейн (Фэвэр))	Сделав предложение руки и сердца непокорной озорнице Генриетте Эшби, сэр Дэниел Драммонд, доселе не склонный связывать себя брачными узами, несказанно изумил и друзей, и недругов, и более всего самого себя. Леди Драммонд немедленно обратила семейную жизнь в полный любви и радости веселый беспорядок… но счастье молодоженов было недолгим. Петля смертоносной интриги все туже стягивается вокруг Дэниела, и вскоре Генриетта осознает, что спасти любимого в силах только она…		
1971	Серебряные ночи	(Фэйзер Джейн (Фэвэр))	Гордую русскую аристократку Софью родные обрекают на безрадостный брак по расчету. Уже назначен день свадьбы, уже приехал тот, кому поручено доставить девушку в дом ненавистного жениха, – граф Адам Данилевский. И внезапно, точно молния, поражает Софью и Адама страсть, противостоять которой невозможно. Но за запретную любовь Софье и Адаму придется заплатить дорогой ценой…		
250	Обещание весны	(Бэлоу Мэри)	Темноволосая красавица Грейс осталась после трагической гибели брата без гроша. Откуда было ждать помощи одинокой молодой женщине? Только от лорда Лэмпмена, преданного друга семьи, предложившего ей руку и сердце. Однако может ли стать радостным брак, заключенный со стороны жениха из благородства, а со стороны невесты – из слепого отчаяния? Может ли такое венчание сделать счастливыми два одиноких сердца, может ли оказаться искрой, что разожжет в них пламя подлинной страсти?..		
256	Сети любви	(Бэлоу Мэри)	Это – история женщины, которую жизнь поставила однажды перед нелегким выбором – выбором между чувством и долгом... Что предпочесть ей – верность пожилому, доброму и благородному супругу, окружившему жену нежностью и заботой, но не способному, увы, покорить се сердце, – или вспыхнувшую внезапно, подобно пожару, страсть к молодому офицеру английской армии, который может предложить ей только неистовую силу своей любви? Возможно, выбор сделает сама Судьба. Однако – каким он будет?..		
257	Сети соблазна	(Бэлоу Мэри)	Над лордам Джеймсом Парнеллом с ранней юности тяготело воспоминание о трагедии, в которой он невольно был повинен. С тех пор Джеймс поклялся никогда больше не влюбляться. Однако клятвы были забыты, когда судьба подарила ему встречу с юной и прелестной Мэддан Рейни – девушкой, что, сама того не желая, завлекла молодого аристократа в сети соблазна. Ибо есть ли на этой земле соблазн неодолимее, чем надежда на новое счастье – счастье подлинной, нежной, страстной любви?..		
258	Счастливый сюрприз	(Бэлоу Мэри)	Прелестная Джозефина Мидлтон никогда в жизни не видела предназначенного ей в супруги герцога Митфорда – по заведомо успела невзлюбить его столь отчаянно, что предпочла ненавистному браку по расчету бегство в неизвестность, навстречу опасным приключениям. И в этот трудный момент на помощь ей приходит загадочный мужественный человек, называвший себя просто мистер Вильерс. Человек, которого Джозефина полюбила страстно и которому отдалась душой и телом, даже не подозревая, кто скрывается под маской таинственного незнакомца...		
1957	Жемчужина гарема	(Фэйзер Джейн (Фэвэр))	Могущественный афганский властитель Акбар-хан совершил большую ошибку – решив наказать строптивую наложницу Айшу, уступил ее на ночь английскому лейтенанту Киту Рэлстону. Мог ли предположить Акбар – хан, что одна – единственная ночь страсти зажжет в сердцах британского офицера и зеленоглазой красавицы, с детства обреченной на долю рабыни, пожар безумной любви? Теперь Рэлстон готов поставить на карту и карьеру, и жизнь – для того, чтобы спасти Айшу от ее безжалостного господина…		
2219	Шепчи мне о любви	(Басби Ширли)	Юная Моргана, выросшая в грязных трущобах Лондона, слишком хорошо знала, какая судьба ожидает красавицу-нищенку, а потому предпочла стать воровкой. Девушка с детства поклялась, что никогда не станет ничьей любовницей, и держала клятву – пока не встретила неотразимого, мужественного американца Ройса Манчестера. Напрасно пыталась Моргана противостоять охватившему ее пожару страсти, напрасно боролась с собой – любовь к Ройсу была сильнее доводов рассудка...		
2221	Ради твоей улыбки	(Беверли Джо)	Блестящий аристократ Николас Дилэни долгие годы бежал от брака как от чумы... но в глубине души всегда оставался истинным джентльменом. Именно поэтому, желая спасти репутацию обесчещенной девушки, он предложил ей руку и сердце. От появления в своем холостяцком доме молодой жены Николас поначалу не ждал ничего, кроме несчастий и хлопот... но постепенно невинное очарование юной Элинор Чивенхем покорило его, и беспутный прожигатель жизни познал всю силу любви — любви нежной и страстной, возвышенной — и земной...		
2222	Нежеланный брак	(Беверли Джо)	Ослепительная Бет Армитидж, казалось бы, созданная для любви и блаженства, скрывала свою пылкую душу под маской неприступной, ироничной особы. Кто же сможет разглядеть верную и нежную возлюбленную в холодной красавице? Только – самый отчаянный повеса лондонского света. Только – единственный, кто сумеет соблазнить девушку, предназначенную ему в жены, и разбудить в ней жаркую, чувственную страсть...		
826	Искушение	(Квик Аманда)	Невероятная любовная история начнется в мрачных пещерах, где герои обнаружат украденные драгоценности и встретят свою любовь. Словно в знаменитой сказке, Красавица полюбит Чудовище. Любовь отважной и очаровательной Гарриет победит клевету и предательство и научит любить исстрадавшееся сердце виконта Сент-Джастина.		
1989	Во власти бури	(Хармон Данелла)	Прекрасная английская леди, выдающая себя за юношу-жокея, и бесстрашный искатель опасных приключений… Рыжекудрая Ариадна – и мужественный Колин Лорд. Мужчина и женщина, предназначенные друг для друга самой судьбой…Они встретились врагами, но стали деловыми партнерами, решившись на отчаянный план молниеносного обогащения, – и верными друзьями в час грозной опасности. Однако друзья иногда могут стать и возлюбленными – возлюбленными, которых навсегда связали узы пламенной, чистой, земной и святой страсти…		
2551	Пират в моих объятиях	(Хармон Данелла)	О пирате Сэме Беллами ходило множество легенд. Врага говорили о его жестокости, друзья, – об отваге и мужестве. А множество женщин превозносили дьявольскую красоту и обаяние самого лихого из капитанов Семи морей. Однако все отступило для Сэма в прошлое, когда он встретил Марию Холлет, золотоволосую и невинную. Встреча с девушкой, похожей на ангела, вернула в жизнь отважного корсара любовь, страсть и надежду на счастье…		
2547	Предвкушение счастья	(Хармон Данелла)	Отважный Брендан Джей Меррик, самый знаменитый из капитанов-каперов, презирал женщин. Каково же было ему обнаружить женщину на борту своего судна! Каково было признать, что юная дочь судостроителя Майра Эштон превосходит смелостью и мужеством самых отчаянных его матросов! Женщина на корабле – к беде. Так считают моряки. Однако прелестная Майра стала бедой не для корабля, но – для капитана. Ибо неистовая, всепоглощающая страсть к этой девушке превратилась для него в муку. Но эта же страсть открыла ему подлинный смысл жизни и подарила счастье…		
1491	На всю жизнь	(Райан Нэн)	Хозяин развеселого салона Ник Мак-Кейб и рассудительная Кей Монтгомери, решившая посвятить свою жизнь благотворительной деятельности, - что может связывать столь разных людей? Только - ЛЮБОВЬ. Страстная, пылкая любовь, что пробуждает в циничном повесе мужчину, готового пожертвовать жизнью во имя возлюбленной, а в «унылой старой деве» - пылкую и чувственную женщину, созданную для счастья...		
1699	Обет любви	(Спенсер Мэри)	Это история гордого рыцаря Эрика Стэйвлота, поклявшегося доставить любимую женщину к чужому брачному ложу, и юной леди Марго ле Брюн, что втайне дала клятву не принадлежать никому, кроме сэра Эрика, покорившего ее сердце еще в детстве. И тогда начинается песнь высокой любви – обжигающей, опасной и изысканно-галантной. Начинается история нарушенных обетов…		
1960	Колдунья	(Фэйзер Джейн (Фэвэр))	Хьюго Латтимеру, обуреваемому мрачными воспоминаниями и мучительным отчаянием, менее всего нужна была любовь непредсказуемой, дерзкой красавицы Хлои Грэшем: ее природная чувственность лишала его самообладания. А ведь именно он был обязан сделать из юной девушки леди и выдать ее замуж за богатого лорда в Лондоне…		
76	Райский остров	(Барнет Джилл)	Самоуверенная белокурая красавица и сильный, решительный мужчина волею случая оказались на райском тропическом острове! Конечно, Хэнка безумно раздражает Маргарет. Конечно, Маргарет начинает испытывать неприязнь к Хэнку. Но говорят, от ненависти до любви – один шаг! И вот уже Хэнка и Маргарет влечет друг к другу внезапно вспыхнувшая страсть. Страсть жгучая и неодолимая, чувственная и чистая, небесная и земная...		
1974	Тщеславие	(Фэйзер Джейн (Фэвэр))	Несправедливость и жестокость родных довела до отчаяния юного графа Каллума Уиндхэма, лишили юношу всего – имени, состояния, будущего. Отныне нет благородного Каллума – есть лишь опасный и отважный Лорд Ник, не выбирающий средств отмщения. Но прелестная Октавия Морган, которой надлежало стать оружием Уиндхема в его тайной войне, неожиданно изменила в его жизни все…		
1975	Фиалка	(Фэйзер Джейн (Фэвэр))	Легендарная предводительница разбойников по прозвищу Фиалка и полковник английской армии лорд Сент-Саймон встречаются на горных перевалах Пиренеев при весьма странных обстоятельствах: Фиалка попадает в плен к французам, и полковник должен освободить эту юную особу с огромными фиалковыми глазами…		
3931	Чистое искушение (Невинный соблазн)	(Мэйсон Конни (Мейсон))	Лорд Джейк Грейсток задумал свой розыгрыш поистине гениально. В самом деле, что может быть забавнее, чем обучить служаночку-ирландку Мойру светским манерам и превратить ее в королеву избранного лондонского общества?! Беспутный повеса не учел лишь того, что доверчивая, детская невинность и ангельская красота Мойры зажгут в его сердце пожар подлинной, страстной любви. Любви, перед всемогущей властью которой рано или поздно померкнет все его аристократическое высокомерие…		
1553	Опасный мужчина	(Роджерс Розмари)	Прелестная дочь калифорнийского миллионера Виктория Райен узнала, что предназначена в жены человеку, которого не любит. Она поклялась щедро заплатить любому, кто поможет ей бежать. Помощник нашелся – но какой! Трудно было найти менее подходящего ангела-хранителя, чем Ник Кинкейд, опасный для врагов, но еще более – для красивых женщин…		
2765	Любовь-победительница	(Смит Барбара Доусон)	Молодой герцог Адам Сент-Шелдон был готов пойти на все, чтобы найти убийцу своего брата. Даже – выдать юную и невинную Мэри Шеппард за роскошную куртизанку, сделав ее своеобразной "приманкой" для убийцы! Однако обольщение и соблазн – оружие обоюдоострое. И вскоре Адам, превративший скромницу Мэри в обворожительную красавицу, познавшую силу своих женских чар, сам попадает в плен ее очарования. Так начинается эта история. История пылких страстей, дерзких интриг и пламенной, безумной всепобеждающей любви.		
2179	Чудовище	(Айвори Джудит)	Эта страстная, романтическая любовь началась на корабле, когда американская красавица Луиза Вандермеер плыла в Европу к жениху-аристократу. Любовь к незнакомцу, встречавшемуся с девушкой лишь под покровом темноты, захватила Луизу. Она возненавидела своего будущего мужа, всеми силами души стремясь к таинственному возлюбленному, покорившему ее сердце…		
