20927	Горец-варвар	(Хауэлл Ханна)	У старого лорда нет детей, и единственной наследницей его земель и замка предстоит стать племяннице Сесилии, леди Доналдсон. Однако сумеет ли хрупкая девушка управлять огромным имением? Сумеет ли разобраться в сложных отношениях горских кланов? Выход один - Сесилии надлежит вступить в брак, и мужем ее должен стать дальний родич лэрда, отважный воин Артан Мюррей. Но брак Сесилии и Артана, возможно, не состоится. Потому что у юной леди уже есть жених - образованный, изящный сэр Фергюс. И все что Артан может противопоставить тонким манерам сэра Фергюса, - это мужество, храбрость и умение укрощать самых строптивых женщин...		
27810	Горец-любовник	(Хауэлл Ханна)	Юная шотландская аристократка похищена дикими горцами. Гордая и независимая Алана Мюррей бесстрашно отправляется на поиски сестры... и сама оказывается в плену! Помощи ждать неоткуда. Единственный, на кого она может рассчитывать Алана, - это ее собрат по несчастью Грегор Макфингел Камерон. Вместе они совершают дерзкий побег. Вместе противостоят бесчисленным опасностям. Но что сближает их - простая дружба или узы пылкой, неистовой и неодолимой страсти?		
26285	Дурная слава	(Хенли Вирджиния)	«Ангел лицом и дьяволенок нравом», — говорили о Марджори де Варенн с детских лет. И как же нелегко найти для этой красавицы подходящего супруга среди надменных норманнских аристократов, полагающих, что женщина должна быть лишь украшением пиров и турниров, которые устраивает ее супруг! Однако Марджори сама отлично знает, с кем намерена связать свою судьбу. Конечно, с мужественным рыцарем Гаем де Бошаном, знаменитым войной и не менее известным обольстителем! Свадьба должна вот-вот состояться. Но коварные происки опекунов девушки грозят навеки разбить счастье влюбленных...		
8346	Ее властелин и повелитель	(Хокинс Карен)	Герцог Рочестер не оставил законного наследника, - Однако по миру разбросано немало его отпрысков. Перед смертью герцог поручил хитроумному слуге Ривсу непростое задание - отыскать всех его незаконных детей! Первый на очереди - капитан Тристан Левант, прославившийся в Наполеоновских войнах. Только как сделать джентльмена из сурового морского волка? Ривсу приходит потрясающая идея - здесь поможет женщина! И тогда в доме отважного капитана появляется остроумная и насмешливая Пруденс Тистлуэйт, намеренная любой ценой приручить и укротить строптивого красавца!		
27813	Загадочный джентльмен	(Хокинс Карен)	Загадочный и неуловимый разбойник Джентльмен Джеймс. Его "подвигами" восхищались в аристократических гостиных Лондона. О нем мечтали первые красавицы высшего света. Но теперь Джентльмен Джеймс намерен остепениться, принять наконец фамильное состояние, титул виконта Уэстервилла и... вступить в достойный брак. Сдержанная и замкнутая леди Элизабет как нельзя лучше подходит на роль супруги. Но желает ли она соединить свою жизнь с виконтом? Представьте, нет! Однако это не пугает бывшего разбойника. И покорение леди Элизабет станет, возможно, самым опасным приключением в его жизни.		
26263	Нечто греховное	(Энок Сюзанна)	Темноволосая богиня, чья экзотическая красота вызывает в памяти жаркие южные ночи и заставляет мужчин терять разум от страсти, — таково было первое впечатление лорда Шея Гриффина от юной леди Саралы Карлайл. Однако прелестная Сарала наделена не только красотой, но и... редкой деловой хваткой. Раньше, чем Шей успевает опомниться, девушка вырывает у него из-под носа выгодную сделку! За этим должна последовать страшная месть! Но как отомстить столь очаровательной конкурентке? Возможно, следует пустить в ход все приемы обольщения и завладеть сердцем Саралы?..		
38159	Как спасти репутацию	(Эшли Дженнифер)	Миган Тэвисток прекрасно понимала, почему Александра, герцога маленького южноевропейского королевства, признали своим самые отъявленные ловеласы и кутилы лондонского света. Он был прирожденным обольстителем, и устоять перед его чарами не могла ни одна женщина... так же как и сама Миган. Впрочем, она старалась держать пылкого красавца на расстоянии, пока однажды в результате нелепой ошибки весь Лондон не уверился: они с герцогом — любовники. Теперь Миган вынуждена решать — или погубить навеки свою репутацию, или стать женой Александра и вместе с ним окунуться в мир пылкой страсти и опасных приключений…		
38508	Скандал ей к лицу	(Басби Ширли)	Такого громкого скандала в Лондоне не было уже давно. Граф Джулиан Уиндем застигнут в уединенной хижине с Нелл Энслоу, богатой наследницей, бежавшей из дома! В столь пикантной ситуации настоящий джентльмен должен немедленно жениться на скомпрометированной девушке. И здесь неуместно даже упоминание о том, что они раньше никогда не встречались, а всего лишь пережидали грозу. Джулиан от венчания не отказывается. Однако строптивая Нелл не желает скоропалительного брака, в то время как "случайный жених" не на шутку влюбляется в свою "невесту".		
49425	Репутация леди	(Берд Николь)	Мэдлин Эплгейт, посвятившая свою жизнь заботам об отце, даже не мечтала о замужестве. Все решил забавный инцидент: молодую леди, упавшую без чувств, подхватил Эйдриан Картер, виконт Уэллер, и эти случайные объятия стали причиной скандала! Мэдлин скомпрометирована. Спасти положение может только скорейший брак. Так начинается увлекательная, забавная история, полная нелепых ошибок и опасных приключений, в финале которой герои обретают взаимную любовь и счастье.		
36288	Скандальная леди	(Берд Николь)	Нет, спокойная жизнь определенно не для Офелии Эпплгейт. Она страстно мечтает стать актрисой и готова ради этого на все, даже сбежать в Лондон. Ее сестре-близнецу Корделии ничего не остается, как последовать за взбалмошной Офелией. Но Лондон совсем не так гостеприимен, как кажется поначалу, особенно для двух очаровательных девушек, оказавшихся в незнакомом городе. Неизвестно, чем бы закончилась эта авантюра, если бы не красавец Рэнсом Шеффилд, готовый защитить сестер от опасностей, подстерегающих их на каждом шагу... И кажется, одна из них навсегда пленила его гордое сердце...		
45697	Музыка теней	(Гарвуд Джулия)	Мир между Англией и Шотландией должен быть восстановлен. И порукой тому — предстоящий брак одного из самых могущественных лэрдов Шотландии и дочери знатного английского барона. Но этим намерениям не суждено осуществиться. В Шотландском нагорье разгорелся пожар междоусобной войны, и красавица Габриела оказалась в страшной опасности. Однако на защиту ее встал отважный горец Кольм Макхью, подаривший прекрасной англичанке свое сердце и готовый на все, лишь бы спасти ее жизнь и честь.		
36500	Охота за женихом	(Гейлен Шана)	Джозефина Хейл всегда мечтала о приключениях и сокровищах. И она не успокоится, пока не найдет скандально известное наследство, оставшееся от деда-пирата. Для этого ей необходима вторая часть карты, которая, к сожалению, принадлежит Стивену Даблдею графу Уэстману - заклятому врагу семьи Хейл. Но Джозефина готова на все ради своей цели, даже если для этого придется... соблазнить красавца Стивена.		
28374	Выгодный жених	(Грассо Патриция)	Князь Михаил — лакомый кусочек для незамужних девиц. Богат, красив, обходителен — во всех отношениях выгодный жених. Да он и сам готов связать себя узами брака. И даже невесту выбрал. Белл Фламбо. Вот кто идеально ему подходит. Однако девушка не желает выходить за князя. Белл считает, что он ухаживает за ней из жалости, ведь она не красавица. Сумеет ли князь убедить Белл в искренности своих чувств? Поверит ли Белл, что его страсть и любовь не притворство?		
52505	Нежная обманщица	(Гротхаус Хизер)	Отважный нормандский завоеватель рыцарь Николас Фицтодд, барон Крейн, — большой любитель вина и женщин — однажды с изумлением обнаружил, что его поймала в брачные сети красавица француженка. Любить обманщицу? Только не это! Николас готов подарить юной Симоне дю Рош свое имя, но не свое сердце. И все же очень скоро он влюбляется в молодую супругу и понимает, что встретил наконец женщину, к ногам которой бросает все — и богатство, и жизнь.		
37760	И он ее поцеловал	(Гурк Лаура Ли)	Эмма Дав, мечтающая стать светским хроникером, ради достижения своей цели готова занять место секретаря у известного прожигателя жизни виконта Гаррисона Марлоу. Ведь именно он может открыть для нее путь в журналистику — профессию, которую в викторианской Англии считают совсем не женской! Однако у виконта в отношении Эммы совсем иные планы — он намерен просто соблазнить независимую, ехидную красавицу. Впрочем, на случай неудачи у него заготовлен и другой вариант. Ведь если женщину невозможно сделать любовницей — значит, из нее выйдет превосходная супруга!		
47186	В плену твоих желаний	(Джеффрис Сабрина)	Когда-то сэр Лахлан Росс был богатым аристократом, однако жестокое коварство вынудило его избрать опасную жизнь "благородного разбойника". Все эти годы отважный горец мечтал лишь об одном — отомстить врагам, и вот мечта становится явью. В его руках — леди Венеция Кемпбелл, дочь главного недруга. Теперь сэр Лахлан вершит ее судьбу. Жажда мести борется в душе Лахлана с благородством, а между тем он все сильнее подпадает под власть очарования прекрасной Венеции и все больше запутывается в сетях пылкой страсти.		
51211	Невеста полуночи	(Джонсон Софи)	Суровый рыцарь Мерек Блэкторн, о боевой отваге и ярости которого ходили легенды, поклялся никогда не жениться, ибо сам страшился своего нрава. И все же обвенчался с юной Неттой Кар-Колдуэлл, потому что другой возможности спасти девушку от жестокого отца просто не было. Нетта должна найти в замке Блэкторна защиту и покровительство, но не любовь и супружеские ласки. По крайней мере так он задумал. Однако молодая жена вовсе не считает супруга чудовищем. Более того, Нетта страстно влюблена в Мерека и свято верит: он — просто мужчина, мечтающий о счастье и наслаждении, а она — женщина, способная подарить ему и то, и другое.		
46061	Расчет или страсть?	(Джордан Софи)	Красавица Порция, леди Дерринг, принадлежит к благородному, но обедневшему семейству. А очередь женихов, как известно, не выстраивается за бесприданницами. Родные убеждают девушку выйти замуж по расчету. И граф Хит Мортон — просто идеальный кандидат в мужья. Ведь он в отличие от Порции богат. А его скандальная слава — это так, мелочи. Леди Дерринг вынуждена ответить согласием на предложение графа, но она не намерена становиться бессловесной покорной супругой! Хит Мортон будет обладать ею, только если превратится в идеального джентльмена и полюбит жену со всей силой пламенной, искренней страсти!		
45103	Серенада любви	(Дэн Барбара)	Выбор у Лидии Мастерс был невелик: либо она становится женой совершенно незнакомого человека, либо отправляется под суд по обвинению в государственной измене. Естественно, Лидия выбирает первое. Однако сразу же дала понять своему спасителю капитану Брюсу Макгрегору, что согласна лишь называться его супругой. Ни о какой любви не может быть и речи. Бесстрашный морской волк только усмехнулся, услышав это заявление, — ведь не было еще ни одной женщины, которую он не сумел бы покорить. Неужели перед его мужественным обаянием устоит законная супруга?		
52577	Тайный роман	(Квик Аманда)	Луиза Брайс и Энтони Столбридж принадлежали к разным мирам и вряд ли могли встретиться. Однако судьба сильнее условностей света, и при самых неожиданных обстоятельствах они знакомятся в доме богатого и могущественного человека, которого оба подозревают в жестоком убийстве. Теперь Луиза и Энтони поневоле вынуждены вести расследование вместе – и вместе противостоять смертельной опасности. Однако чем больше они рискуют жизнью, тем сильнее разгорается в их сердцах пламя жгучей страсти.		
51283	Встреча с судьбой	(Коул Кресли)	Бауэн Макрив, лучший воин таинственного клана шотландских горцев, служащих Луне, потерял невесту, и сердце его было похоронено вместе с ней. Отныне, считал Бауэн, в жизни его не будет любви, а ложе навеки останется одиноким. Шли годы, а воин по-прежнему был верен памяти невесты. Но однажды он встретил одну из тех, кого должен был ненавидеть, - Марикету Долгожданную, девушку из враждебного клана, обладающую таинственными колдовскими способностями. И тогда заледеневшая душа Бауэна оттаяла под лучами новой любви - любви страстной, чувственной и нежной. Любви, которая подарит им с Марикетой счастье или погубит их обоих.		
53623	Если обманешь	(Коул Кресли)	Когда-то могущественный аристократ искалечил лицо Итану Маккаррику. Но еще более глубокие шрамы остались у него на сердце. Гордый шотландец жил только мечтой о мести. Прошло десять лет. Мэдлин Ван Роуэн, дочь его врага, подросла и стала красавицей, и в душе Итана созрел жестокий план – влюбить ее в себя, обесчестить и бросить. Поначалу все идет так, как было задумано. Но неожиданно Итан понимает: жажда отмщения уступила место жгучей и властной страсти, которая сильнее любой ненависти. Что, если Мэдлин узнает о его прежних намерениях? Больше всего на свете Итан боится ее потерять.		
51548	Если пожелаешь	(Коул Кресли)	В юности Хью Маккаррик отдал свое сердце прелестной англичанке Джейн Уэйленд, хотя и знал, что у этой любви нет будущего – ведь его избранница разделит с ним и довлеющее над его родом проклятие. Чтобы не подвергать возлюбленную опасности, Хью решил просто-напросто бежать. Прошли годы, и однажды Хью и Джейн встретились вновь. Теперь он – наемный телохранитель, которому предстоит оберегать дочь британского генерала от таинственных убийц, и никаких личных отношений между ними быть не может. По крайней мере так считает Маккаррик. Но Джейн ничего не забыла – и любовь к мужественному горцу по-прежнему жива в ее душе.		
49632	Благородство и страсть	(Кэмпбелл Анна)	Прекрасная молодая вдова Грейс Паджет похищена и доставлена в мрачное имение, затерянное в сельской глуши. Там ей под страхом смерти приказывают исполнять любые желания загадочного узника. Узником оказался лорд Шин, который вовсе не намерен пользоваться беспомощным положением Грейс. Он добр и приветлив с ней и не собирается посягать на ее честь, хотя буквально сходит с ума от страсти. В сердце Грейс просыпается сначала благодарность, затем доверие, - а потом и любовь. Подлинная, пламенная любовь, какой ей не довелось узнать в коротком и несчастливом браке.		
