6869	Отцы и дочери	(Райс Патриция)	Из сборника Плененные сердца. Любовь не знает ни законов, ни границ. Любовь — смысл жизни всякого настоящего мужчины и всякой истинной женщины. На Диком Западе и в салонах лондонского света, на тропических островах и в идиллических сельских усадьбах — для любви есть место везде и всегда. Для любви страстной и нежной. Для любви властной и требовательной.		
8134	Зеленоглазая леди	(Робардс Карен)	Джулиан Чейз прошел огонь и воду. Он не страшился ни Бога, ни дьявола, ни закона - и превыше всего ставил свою независимость. Так почему же случайная встреча с гордой и решительной Анной Траверн изменила всю его жизнь? Жаждет ли он отомстить виновнице всех своих несчастий? Или, напротив, желает обладать Анной и - добром, хитростью или силой - заставить ее стать его женой? Оскорбленный мужчина смертельно опасен. Но мужчина, сгорающий от страсти, много опаснее!		
1615	Черная роза	(Скай Кристина)	Благородного разбойника, грабящего богачей и помогающего беднякам, ненавидели мужчины и обожали женщины. Однако ни враги, ни друзья не могли и подумать, что под маской таинственного «джентльмена с большой дороги» скрывается прелестная Тэсс Лейтон. Лишь один человек - виконт Рейвенхерст - знает секрет красавицы, и уж он-то, долгие годы мечтавший о Тэсс, не замедлит этим воспользоваться. Требования виконта просты - Тэсс должна полюбить его, всем сердцем ответить на горячую страсть...		
49636	Возлюбленная	(Смолл Бертрис)	Долго сопротивлялась юная Дизайр мужественному обаянию Моргана Тренчарда - грозного разбойника с большой дороги. Молодые люди полюбили друг друга и пронесли любовь через вынужденную разлуку, тюремные застенки и стихию лондонского пожара. События, описываемые в романе, происходят в период правления короля Карла II Стюарта. Эта книга в действительности написана Д. Хэвиленд, но наши издатели "приписали" ее к авторству Б. Смолл.		
1646	Ворон (Миг вечности)	(Смолл Бертрис)	Человеческая жизнь – миг в безбрежном море вечности. Но душа человека бессмертна, она хранит память о любви к другой душе, проносит ее через века. Эта красивая сказка начинается в Уэльсе в одиннадцатом веке, но память Уинн из Гарнока и принца Мейдока возвращает их во времена более давние.		
2708	Дикий мед	(Финч Кэрол)	Мариа Лэверти, женщина сильная духом, решила поселиться в дикой глуши Нью – Мексико в гордом одиночестве. Все, чего она хотела от хозяина ранчо Девлина Грэнджера, – это несколько уроков по обустройству жизни в горах Запада. Однако Дэвлин преподал Мариа совсем иные уроки – любви, нежности, самозабвенной страсти и невероятного счастья…		
2008	Украденный экстаз	(Хауэлл Ханна)	Юная Лина Саммерс внезапно оказалась в руках шайки лихих бандитов. Могла ли испуганная девушка предположить, что предводитель этих грабителей, мужественный и отважный Хантер Уолш, станет ее любовью, ее защитником, мужчиной, впервые пробудившим в ней пламя страсти? Однако Лине и Хантеру грозит разлука. Смогут ли влюбленные отстоять свое счастье?…		
2678	Любовь и триумф	(Хэган Патриция)	Смятение и хаос войны вторглись в судьбу прекрасной Мэрили Колтрейн, и некому было подать красавице руку помощи в час опасности. Некому, кроме бесстрашного синеглазого Корда Брандта, в совершенстве постигшего как изощренное искусство шпионажа, так и прекрасное искусство любви. Корд стал для Мэрили защитником, рискующим ради нее жизнью, и мужчиной, превратившим ее существование в триумф обжигающей страсти, сметающей на своем пути любые преграды, – страсти всепоглощающей, священной, земной…		
6455	Властелин моего сердца	(Беверли Джо)	Кто бы мог подумать, что бесстрашный рыцарь короля Эмери де Гайар и благородный разбойник по прозвищу Золотой Олень, грабящий знатных богачей и раздающий награбленное бедным крестьянам, — один и тот же человек? Никто… кроме юной Мадлен де Л`От-Виронь, по приказу короля Вильгельма вынужденной идти с Гайаром под венец. Однако постепенно ужас и ненависть Мадлен к нелюбимому жениху сменяются восхищением перед его мужеством — и жгучей, пламенной страстью к этому опасному и сильному мужчине…		
45346	Рождественский ангел	(Беверли Джо)	Леандр Ноллис, граф Чаррингтон, устал от сражений и дипломатических интриг. Он мечтает о жене, о детях, о семейном уюте. Правда, любовь в его планы не входит. Молодая вдова Джудит Росситер, кажется, идеально подходит на роль его спутницы — она тоже не склонна требовать от нового мужа ничего, кроме дружбы и уважения. Союз Джудит и Леандра трудно назвать браком, заключенным на небесах. Но однажды и эту рассудительную парочку настигает любовь — страстная, неистовая, безграничная.		
182	Дикий цветок	(Браун Вирджиния)	Молва твердила: еще ни одному мужчине не удалось удержать в своих объятиях Колорадо Кейт — самую красивую и дерзкую из разбойниц Дикого Запада, и ни одному служителю закона не удалось ее поймать.Но бесстрашный стрелок Джейк Лесситер дал себе зарок — он будет не только единственным, кому удастся схватить зеленоглазую преступницу, но и единственным, кто навеки станет для нее возлюбленным, повелителем и защитником в час опасности.		
5127	Тайное прикосновение	(Браун Вирджиния)	Герцог Деверилл отлично понимал, что лучше всего было бы просто расстаться с очаровательной девушкой-сиротой, просившей у него помощи, но сердце не всегда слушается доводов разума... Прошло три года, и "опекун поневоле" должен вывести воспитанницу в свет и подыскать ей подходящего жениха. Однако юная Алиса Трентон, получившая воспитание настоящей леди и ставшая дивной красавицей, по-прежнему хранит в душе пылкую любовь к герцогу - любовь, пламя которой вспыхнуло с первого же взгляда! Этот мужчина будет принадлежать только ей...		
3614	Ангел (Нежный ангел)	(Бристол Ли)	Ее звали Энджел - Ангел, и ее невинная прелесть в полной мере соответствовала имени. Никто бы не подумал, что Энжел Хабер блестяще управляется и крапленой колодой и острым стилетом! Неужели опасная красавица - та самая маленькая девочка, опекать которую когда-то поклялся Адам Вуд? Увы, сомнений нет! Адам решает спасти свою подопечную от преступной жизни и повести к алтарю, но Энжел намерена дорого продать свою свободу. Ей нужна только любовь - любовь подлинная и страстная, чувственная и самозабвенная…		
343	Навсегда в твоих объятиях (Навеки-навсегда)	(Вудивисс Кэтлин)	Полковник Тайрон Райкрофт обладал многими женщинами, но ни одной из них не удалось покорить его сердце — до того дня, когда он чудом спас от верной гибели гордую русскую аристократку. Красота этой загадочной женщины ослепила Тайрона — и мужественный англичанин впервые в жизни познал не мимолетное желание, но подлинную любовь. Любовь страстную, неодолимую, пылкую. Любовь, во имя которой он не задумываясь поставит на карту свою жизнь...		
382	Тайна	(Гарвуд Джулия)	Джудит Хэмптон – гордая английская красавица. Долгие годы она ждала встречи с тем, в чьих жарких объятиях могла бы забыть свои печаль и одиночество. Йан Мэйтленд – неукротимый шотландский горец. Он не доверял женщинам и не верил в любовь... пока любовь не покорила его суровое сердце. Их страсть вспыхнула внезапно. Так вспыхивает пожар на шотландских вересковых пустошах, где каприз судьбы свел двоих людей, предназначенных друг другу небом. Старинная семейная тайна мешает им обрести счастье, но Джудит и Йан поклялись, что сумеют защитить свои чувства...		
2446	Любимая	(Грегори Джилл)	Коул Роудон, однажды переживший боль жестокого предательства, привык доверять только своему верному "кольту". Однако жизнь этого сурового человека разительно переменилась после встречи с юной Джулианой Монтгомери, бежавшей от брака с могущественным негодяем. Джулиана стала для Коула не просто нежной и пылкой возлюбленной. Она оказалась женщиной, возвратившей ему надежду и мечту, огонь неодолимого желания и счастье настоящей любви – любви, ради которой стоило поставить на карту все…		
2471	Желанная и вероломная	(Грэм Хизер (Хедер))	Кажется, еще вчера Келли и Дэниел любили друг друга и были счастливы… пока их не разделила Гражданская война. Пока девушка невольно не предала любимого и он не поклялся вернуться и отомстить. Келли с ужасом ждала этого, и однажды Дэниел действительно оказался на пороге ее дома. Однако не ненависть и месть привели мятежника к прекрасной предательнице, а жгучая, непреодолимая страсть, побороть которую невозможно...		
2472	Непокорная и обольстительная	(Грэм Хизер (Хедер))	Отгремевшая Гражданская война разрушила привычный безмятежный мир Кристы Камерон, и прекрасная южанка поклялась ненавидеть победителей – янки до последнего вздоха. Однако сильнее ненависти оказалась любовь, и именно враг, мужественный полковник Джереми Макгоули, покорил гордое сердце Кристы. Напрасно красавица боролась с собой – пожар страсти в одночасье сжег преграды вражды и предубеждений, а опасности лишь укрепили силу чувства Кристы и Джереми…		
503	Вечность	(Деверо Джуд)	Любовь с первого взгляда возможна, а с первого взгляда и по фотографии? Бывает и такое. Богатая и избалованная красавица Кэрри очарована молодым вдовцом Джошуа Грином, который прислал свою фотографию для заочного знакомства с будущей женой, подругой Кэрри. Он беден и у него двое детей, но в его взгляде Кэрри прочла, что он ждет только ее.		
627	Обрученная с ветром	(Дрейк Шеннон)	Не так давно Пирс Дефорт был блестящим знатным лордом, а теперь, преданный и оболганный, он вынужден искать удачи под черным пиратским флагом. Отныне нет больше благородного дворянина, а есть безжалостный корсар по прозванию Победитель Драконов, живущий, чтобы мстить. Но исступленная жажда мести угасла, едва Пирс вновь встретил величайшую любовь своей юности - прекрасную и пылкую леди Розу...		
822	Безрассудство	(Квик Аманда)	Прекрасная Феба Лейтон, с детства погруженная в романтический мир рыцарских романов, мечтала встретить того единственного, кто станет для нее рыцарем без страха и упрека, - и однажды обрела его в загадочном и безрассудно отважном Габриэле Баннере, графе Уальде. Их любовь, неистовая и безрассудная, предрешенная самим небом, вспыхнула подобно пожару, – и никакая опасность, никакая угроза не в силах были погасить это обжигающее пламя.		
826	Искушение	(Квик Аманда)	Невероятная любовная история начнется в мрачных пещерах, где герои обнаружат украденные драгоценности и встретят свою любовь. Словно в знаменитой сказке, Красавица полюбит Чудовище. Любовь отважной и очаровательной Гарриет победит клевету и предательство и научит любить исстрадавшееся сердце виконта Сент-Джастина.		
3038	Цветы из бури (Властная сила любви)	(Кинсейл Лора)	Действие этого любовно-авантюрного романа происходит в Англии 18 века. Прелестная Архимедия Тиммс, дочь бедного математика влюблена в блестящего герцога Жерво, который тяжело страдает от болезни, на первый взгляд неизлечимой…		
874	Нам не жить друг без друга	(Клейпас Лиза)	Любовь – приходит внезапно – неожиданная, непредсказуемая. Могла ли прекрасная француженка Селия Валлеран, гордая аристократка, и предположить, что станет возлюбленной грозного капитана корсаров по прозванию Грифон? Могла ли вообразить, что, впервые охваченная безумной страстью, она поставит на карту все: свою честь, положение в обществе, будущее и даже жизнь – ради любимого мужчины, подарившего ей счастье?		
950	Невеста - обманщица	(Коултер Кэтрин)	Когда молодой Дуглас Шербрук унаследовал фамильный титул графа Нортклиффа, а с ним и солидное состояние, расчетливая красавица, не так давно отказавшаяся стать его женой, немедленно дала согласие на брак. Но с подобной ситуацией не намерена мириться лукавая леди Александра Берсфорд, с детства влюбленная в Дугласа. Она не уступит любимого сопернице – даже если для этого придется женить его на себе обманом, а потом долго завоевывать сердце обманутого супруга...		
1075	Ангел	(Линдсей Джоанна)	Этого загадочного человека называли Ангелом. По пятам за ним следовала слава самого быстрого, самого отчаянного, самого безжалостного стрелка во всем буйном Техасе. Он не верил ни во что, кроме своего "смертоносного кольта"… до той поры, пока его помощи не попросила юная и невинная Касси Стюарт. И тогда Ангел понял, что на свете есть то, о существовании чего он и не подозревал, – любовь. Любовь страстная и нежная, пылкая и сводящая с ума. Любовь, ради которой рискуют жизнью. Любовь, которая может подарить счастье…		
1098	Мужчина моей мечты (Мужчина моих грез)	(Линдсей Джоанна)	Девлин Сент-Джеймс, герцог Ротстон, по недоразумению жестоко повздорил с другом, и единственная возможность избежать дуэли – его немедленный отъезд в далекое поместье. Там, в глухой провинции, настигает Девлина судьба, принявшая очаровательный облик Меган Пенуорти, избалованной дочки сельского сквайера. Молодые люди влюбляются друг в друга с первого взгляда, однако Девлин вынужден выдавать себя за простого конюха, а потому Меган не смеет признаться в нахлынувшем чувстве даже себе самой…		
1163	Только моя	(Лоуэлл Элизабет)	Что общего между индейцем – полукровкой, зарабатывающим на жизнь охотой за мустангами в диких прериях Дальнего Запада, и прелестной, хрупкой шотландской аристократкой? То, что и Вулфу Лоунтри, и Джессике Чартис необходимо срочно вступить в фиктивный брак. Вулф поклялся себе, что никогда не воспользуется отчаянным положением Джессики и не принудит ее к исполнению супружеского долга. Но о каких клятвах и каком принуждении может идти речь, если страсть, точно магнит, притягивает двоих друг к другу?		
1165	Только ты	(Лоуэлл Элизабет)	Не имея ни цента за душой, не веря в удачу, прекрасная Ева, прозванная Вечерней Звездой, от отчаяния поставила на кон в карточной игре себя. Такой безумный поступок мог бы завершиться катастрофой, не приди на помощь красавице бесстрашный стрелок Рено Моран. Однако мог ли бесшабашный искатель приключений вообразить, что та, кого он счел обычной салунной девицей, в действительности – его любовь, посланная свыше?…		
1283	Жар сердец	(Мартин Кэт)	Самые известные "охотники за наградами" рыскали по побережью Джорджии в поисках таинственной красавицы Салины Хардвик-Джоунс - пока, наконец, беглянка не оказалась в руках сурового Моргана Траска, твердо решившего доставить ее обратно домой. Но покоритель морей, презиравший опасность, как-то не учел, что самым опасным врагом, мешающим возвращению Салины, окажется его сердце. И вскоре жестокий тюремщик превращается в галантного защитника и пылкого возлюбленного…		
