57386	Вечные любовники	(Кесслер Джеки)	Входит в сборник "Таинство любви" Джесс Харрис и ее любимый, полицейский Пол Хэмилтон, - вполне обычные и счастливые жених и невеста... если не знать, конечно, о страшной тайне, которую Джесс скрывает от Пола. Ведь она далеко не та, за кого себя выдает! И однажды прошлое возвращается...		
3015	Сделка страсти	(Киддер Джейн)	Красавица Меган Тейлор, чтобы избежать замужества с крайне неприятным типом, хитростью и шантажом принуждает к браку богатого и влиятельного Джеффри Веллзли. Очаровательная плутовка всерьез уверена, что никому не будет вреда, ведь речь идет о фиктивном браке и взаимовыгодном деловом партнерстве. Но Джеффри так красив и мужественен, что очень скоро она влюбилась без памяти и решила превратить фиктивный брак в самый что ни на есть настоящий!		
7252	В поисках любви	(Кинкейд Кэтрин)	Где-то далеко в джунглях Индии затерялась заброшенная плантация, на поиски которой отправляется красавица англичанка Эмма Уайтфилд. Однако, дорога полна опасностей, и девушке необходим спутник, способный ее защитить. Свои услуги Эмме предлагает загадочный Александр Кингстон, отвергнутый чопорным колониальным обществом. Устоять перед магнетическим очарованием этого мужчины невозможно, но можно ли доверять ему, можно ли поверить в подлинность его чувства?		
3968	Благородный разбойник	(Кинсейл Лора)	Благородный разбойник по прозвищу Аллегрето намерен вернуть себе положение в высшем свете, которое должен занимать по праву рождения! И если ему придется обольстить прекрасную Элайн Монтеверде - что ж, Аллегрето привык использовать женщин в своих опасных играх! Однако на этот раз искушенный соблазнитель может пораниться собственным оружием - и влюбиться страстно, пылко, до безумия!..		
6756	Влюбленный опекун	(Кинсейл Лора)	Леди Тесс Коллир, дочь знаменитого путешественника, выросшая в дальних странствиях, неохотно согласилась исполнить последнюю волю умирающего отца - вернуться в Англию и устроить личную жизнь. Капитан Гриф Меридон столь же неохотно согласился принять на себя обязанности опекуна Тесс и подыскать ей подходящего мужа... Чем дальше, тем сильнее Гриф ненавидит многочисленных поклоников, вьющихся вокруг Тесс. Возможно, он просто не видит среди них достойного? Или ревнует? Впервые в жизни Меридон окунулся в омут подлинной страсти - и не желает отдавать любимую женщину другому. А что же леди Тесс? Кого выберет она?		
3036	Летняя луна	(Кинсейл Лора)	Лорд Рэнсом Фальконе пытается разыскать изобретателя, чьи открытия помогут Англии в борьбе против наполеоновской Франции. Совершенно неожиданно выясняется, что это... очаровательная Мерлин Ламбурне, своей красотой способная затмить самых блистательных дам высшего света. Охваченный всепоглощающей страстью, Рэнсом готов пойти на скандал, даже пожертвовать жизнью и положением в обществе, чтобы преодолеть все препятствия и завоевать любовь гордой красавицы.		
860	Летящая на пламя	(Кинсейл Лора)	Юная англичанка по прихоти судьбы становится принцессой маленького государства на экзотическом Востоке - и это очень не нравится коварным, искушенным в придворных интригах вельможам. Опасность поджидает ее за каждым углом, таится в каждом бокале, в каждом цветке. И не у кого просить помощи, кроме отчаянного моряка, запросившего взамен огромную плату - тело и душу принцессы. Любовь нельзя купить - это знают все. Но быть может, настоящий мужчина способен ее завоевать...		
3037	Принц полуночи	(Кинсейл Лора)	Некогда благородный разбойник, теперь живет в глуши. Но однажды к нему за помощью приходит странный гость. Этим гостем оказывается девушка, просящая помощи. Она хочет отомстить за свою семью.		
5925	Робкая магия	(Кинсейл Лора)	Юная Родерика Деламор всегда знала — дар читать чужие мысли принесет ей лишь одиночество и страдания. Кто возьмет в жены «ведьму»? Лишь тот, кого молва также не обошла стороной. Обедневший ирландский аристократ Фэлен Савигар, прозванный Дьяволом, увидел в Родерике ту, о ком страстно мечтал всю жизнь. И теперь ни земные, ни высшие силы не помешают ему завоевать сердце этой девушки!..		
864	Коснись зари	(Кицмиллер Челли)	Кто бы мог поверить, что Хеллер Пейтон, блистательная светская дама, когда-то была девчонкой из грязных трущоб и теперь готова на все, чтобы забыть о прошлом? Никто... кроме одного-единственного человека. Кроме знаменитого и отважного разбойника Хоакина Мурьеты. Лишь он сам, переживший некогда горечь потери любимой, способен понять боль Хеллер - и исцелить ее пламенным прикосновением истинной, страстной, неподдельной любви...		
4787	Счастливое недоразумение	(Клемент Синтия)	Принять молодую вдову, образец благоразумия и порядочности, за "ночную бабочку"? Сара Уэлсли возмущена! Но возмущение ее становится еще сильнее, когда она узнает, что "гнусный оскорбитель" - это недавно вернувшийся из дальнего путешествия маркиз Алекс Колдерн! Алекс всеми силами пытается загладить свою вину перед миссис Уэлсли.		
5265	Если осмелишься	(Коул Кресли)	Гордая кастильская аристократка Аннелия Лоренте презирала отчаянного шотландского воина Корта Маккаррика. А бесстрашный горец увидел в ней женщину, предназначенную ему самой судьбой. Однако согласно таинственному древнему пророчеству, той, кого Корт дерзнет полюбить всем сердцем, суждено принести ему несчастье… Но — чего стоит жизнь настоящего мужчины, если в ней нет места любви? И Корт, угадавший за холодностью Аннелии нежную и пламенную душу, готов на все, чтобы пробудить в ней ответную страсть!		
7477	Цена наслаждения	(Коул Кресли)	Десять лет назад капитан Грант Сазерленд поклялся умирающему старшему другу, что отыщет его внучку, бесследно пропавшую на островах Океании, и станет ее опекуном и защитником. Десять лет понадобилось Гранту, чтобы исполнить свою клятву - и понять, что юная Виктория Дирборн не нуждается в опекуне! Независимая, своенравная красавица хочет от Гранта не защиты и покровительства, но - любови! Страстной и пылкой любви, которую отважный моряк всегда считал слабостью - и которая теперь станет смыслом его жизни...		
927	Рыцарское слово	(Коул Кэндис)	Далекие и суровые времена... Времена, когда каждый английский замок – в руках победителей-норманнов. Времена, когда каждая английская красавица – невеста беспощадного завоевателя. Переодеться в простую крестьянку? Юная леди Адриенна полагает, что только так избежит брачного союза с жестоким и обольстительным Люсьеном. Но и крестьянка может полюбить и принять от возлюбленного клятву верности. Принять, еще не подозревая, что ее сердце пленил именно тот, кого ей следует страшиться и ненавидеть...		
928	Страсть рыцаря	(Коул Кэндис)	Два брата-близнеца, два рыцаря, должны повести к алтарю – волей или неволей – двух знатных наследниц из Уэльса. Таков приказ короля. Только так может Англия подчинить мятежные валлийские земли. Но что же делать лорду Рэйвену из Стоунли, полюбившему не свою невесту, а невесту брата? Что делать мужчине, который впервые в жизни встретил женщину, назначенную ему самой судьбой – и тут же узнал, что она должна обвенчаться с другим? Только – действовать. Во имя своего СЧАСТЬЯ. Во имя своей ЛЮБВИ!		
971	Строптивая невеста	(Коултер Кэтрин)	На Ямайке красавица София Стентон-Гревиль пользовалась известностью женщины весьма свободного поведения и точно целью задалась подтвердить свою сомнительную славу. Иначе зачем бы ей упорно пытаться соблазнить молодого английского аристократа Райдера Шербрука? Однако чем дальше, тем больше подозревает Райдер, что под маской легкомысленной обольстительницы скрывается чистая и невинная девушка, затеявшая рискованную игру с непонятной пока для него целью...		
980	Загадочная незнакомка	(Крейг Эмма)	Юная красавица Софи Мадригал могла прочитать по руке судьбу любого обитателя Дикого Запада... но однажды увидела на ладони сурового и безжалостного Габриэля Кэйна... СВОЕ ИМЯ! Быть может, это обман? Но судьба не лжет! Значит, само небо предназначило Софи ответить на страсть мужчины, непривычного к нежности и ласке. Отчаянный храбрец, не ведавший страха, он только теперь вынужден учиться ЛЮБИТЬ и ЗАЩИЩАТЬ.		
3086	Дикая Роза Техаса	(Крилл Кэтрин)	"Дикую розу Техаса", неугомонную Кейли Роз Бучанен, отправили к родным в Шотландию с четким приказом - без мужа не возвращаться. Мужа и получила девушка, но какого! Во имя отмщения за зло, совершенное давным-давно предком Кейли Роз, она должна стать женой предводителя оскорбленного клана - Яна Мак-Грегора. Расплачиваться за нечто, к чему лично она не имеет никакого отношения, невеста-пленница не желает. Только уж очень трудно ненавидеть страстного красавца Яна...		
3087	Леди Алекс	(Крилл Кэтрин)	Жестокий каприз судьбы забросил Александру Синклер, невинно осужденную знатную леди, на австралийскую каторгу. Но именно там, в этом кошмаре, где нет места надежде, неожиданно встретила леди Алекс мужчину, предназначенного ей свыше, - американца Джонатана Хэзэрда, который не только подарил ей свободу, но и открыл целый мир обжигающей страсти, нежности и наслаждения...		
3088	Техасская свадьба	(Крилл Кэтрин)	Рэнд Логан ухитрился бросить молоденькую Клэр... в первую брачную ночь, сделав несчастную - не то невесту, не то жену - объектом насмешек и унизительного сочувствия всего техасского городка. Годы понадобились легкомысленному беглецу, чтобы осознать, как нелепо потерял он свое счастье, и вернуться домой. Однако Клэр - уже не наивная влюбленная девочка, а гордая, неприступная, преуспевающая женщина, за право обладать которой Рэнду предстоит нелегкая борьба...		
47218	Поцелуй после полуночи	(Кросби Таня Энн)	Из сборника Венчание в полночь Богатая наследница английских аристократов должна вступить в брак, пока часы не пробьют полночь, – и исполняет обязательство…		
3097	Нежное прикосновение	(Крэн Бетина)	Юная Даймонд Вингейт, которую буквально осаждали поклонники, стояла перед нелегкой проблемой: как угадать в толпе воздыхателей того единственного, кому нужно не доставшееся ей по наследству огромное состояние, а ее пылкое, нежное сердце? Возможно, этим единственным окажется грубоватый, независимый бизнесмен Макквайд, пытающийся покорить Даймонд не светским лоском аристократических манер, но обаянием подлинной мужественности и неподкупностью искреннего чувства?...		
3098	Неотразимый обольститель	(Крэн Бетина)	Решительная и независимая Беатрис фон Фюрстенберг привыкла отрицать все, что связывает мужчину и женщину, – не только брак и любовь, но даже силу красоты. Однако, когда Беатрис понадобилась помощь, она вынуждена была обратиться к молодому адвокату Коннору Барроу, известному своим неуважением к слабому полу... Итак, женщина, ненавидящая мужчин, и мужчина, презирающий женщин?.. Война, не признающая правил, — или страстная любовь, сметающая все преграды?.. Возможно, любовь-война! Ведь только на войне и в любви хороши ЛЮБЫЕ СРЕДСТВА!..		
28356	Лорд-обольститель	(Куин Пола)	Приказ короля был ясен: леди Танон Ризанде должна стать женой валлийского принца Гарета ап Овейна. Этот союз сулил огромные политические выгоды Англии, однако никак не устраивал гордую красавицу, не намеренную вступать в брак с "диким кельтом". Однако Овейн, которого боятся враги и почитают бесстрашные воины, не зря считается покорителем женских сердец. Он намерен пустить в ход все свое обаяние и превратить ненависть и презрение своенравной англичанки в пылкую и нежную страсть...		
8120	Женитьба повесы	(Кук Кристина)	Легкомысленный повеса Колин Розмур, обвиненный в нечестной игре, понимает что единственный шанс восстановить репутацию - это удачно жениться. Красавица Бренна Маклахлан богата, умна, держит свое поместье в своих крепких руках, и кажется ее совсем не интересуют мужчины. Так что же ожидает Розмура в будущем - брак по расчету или глубокое,страстное чувство?...		
6863	Неодолимое влечение	(Кук Кристина)	Начинающему политику нужна подходящая невеста - богатая аристократка из семьи, обладающей прочными связями в парламенте. Но почему тогда Генри Эштона неодолимо влечет к ехидной и дерзкой Люси Аббингтон, мечтающей сделать карьеру и стать независимой? О браке не может быть и речи. Незаконная связь - а почему бы и нет? Но Люси упрямо отвергает ухаживания Генри, смеется над его страстью и с наслаждением доводит до бешенства. Любовь? Война! Так кто же сдастся первым?..		
1001	Вслед за луной	(Кук Линда)	Это – история о женщине, которая избегала соблазнов, но однажды была вынуждена довериться самому опасному мужчине Англии... Это – история о мужчине, который поклялся не выбирать средств в борьбе за титул и фамильный замок, но однажды понял, что любовь к женщине – важнее гордости и амбиций... Это – история мужчны и женщины, которые любили друг друга пламенно, страстно и неодолимо. Любили наперекор опасности, угрожавшей не только их счастью, но и их жизни...		
1002	Ночные костры	(Кук Линда)	Прелестная Алиса Мирбо, предназначенная в жены мужественному рыцарю Раймону де Базену, отказывалась поверить в искренность чувств жениха, ибо имела все основания подозревать его в желании выведать старинную семенную тайну – тайну, которую она поклялась сохранять любой ценой. Однако жизни Алисы угрожает клинок таинственного убийцы, и именно Раймон становится для девушки единственным защитником – защитником, готовым снова и снова рисковать собой во имя спасения своей возлюбленной...		
1003	Серебряный ветер	(Кук Линда)	Мужчина, утративший земли и свободу, и женщина, вынужденная спасать свою жизнь ценой лжи и предательства... Что могло выйти из брака злейшего врага короля, сэра Симона Тэлброка, и королевской "шпионки поневоле" – валлийской красавицы Аделины? Смертный приговор для Симона – и вечное горе для Аделины? Или нежданное счастье подлинной любви? Счастье неудержимой и властной СТРАСТИ, сметающей на своем пути любые преграды?...		
1013	Маленький скандал	(Кэбот Патриция)	Может ли истинный джентльмен денно и нощно мечтать об объятиях... компаньонки собственной юной дочери? Может, если джентльмен этот – мужественный маркиз Берк Трэхерн. Может ли скромная, достойная девушка втайне желать... отдаться возлюбленному душой и телом? Может, если девушка эта – прелестная и гордая Кейт Мейхью. Итак, очередной "маленький скандал" в лондонском свете? Или все-таки НАСТОЯЩАЯ ЛЮБОВЬ, не знающая никаких преград?...		
