4179	Золотая лихорадка (Лед и пламя)	(Мэйсон Конни (Мейсон))	Когда нескончаемый поток американцев, канадцев и европейцев устремился в Клондайк за недавно найденным там золотом, туда же отправилась и журналистка Мэгги Эфтон. Но путь на Юкон оказался неожиданно трудным. Здесь девушку ожидали не только тяжкие испытания, но и встреча с отчаянным авантюристом Чейзом Макгарретом. Чейз и Мэгги были абсолютно разными людьми, но обстоятельства заставили их соединить свои судьбы, чтобы выжить среди замерзших равнин Аляски. Внезапно для самих молодых людей, между ними вспыхивает страсть, способная растопить полярные льды…		
55486	По велению любви	(Мэйсон Конни (Мейсон))	Никто не догадывался, что под видом одного из бандитов в шайке, наводящей ужас на всю округу, скрывается юная Китти О`Шей, ступившая на опасную дорогу после гибели близких. Однако ни мужская одежда, ни повадки "своего парня" не способны смирить женское сердце, мечтающее о любви. Сердце, которое бешено билось при первой же встрече с Райаном Делейни. Райан поклялся отцу Китти разыскать и вернуть его пропавшую дочь. И чтобы исполнить свой долг, он не остановится ни перед похищением, ни перед игрой в соблазн и страсть. Но совершенно неожиданно эта игра превратилась в реальность.		
1342	Черный рыцарь	(Мэйсон Конни (Мейсон))	Двенадцать лет назад предательство юной девы едва не погубило молодого Дрейка - и обратило его в жестокого Черного рыцаря, не знающего ни страха, ни жалости. Но теперь Черный рыцарь, самое имя которого внушает страх, наконец-то получил возможность отомстить предательнице! Однако - может ли самый беспощадный из воинов Британии противостоять зову своего сердца, в котором по-прежнему пылает неистовое пламя страсти, особенно сейчас, когда обольстительница леди Рейвен - в полной его власти...		
1371	Из знатного рода	(Новак Бренда)	Натаниэль Кент, прославленный и дерзкий «джентльмен удачи», пытался взять в заложницы знатную британскую леди, - но в результате случайной ошибки его пленницей оказалась бедная юная модистка, пытавшаяся бежать из Англии от издевательств жестокого отчима! Поначалу мужественный капитан был в ярости. Однако очень скоро он понял, что судьба подарила ему встречу с женщиной, которая стала для него всем - пылкой и страстной возлюбленной, преданной и верной подругой, счастьем и истинным смыслом существования...		
1408	Жена незнакомца	(Осборн Мэгги)	Что стояло между мужественным Куинном Уэстином и его мечтой о политической карьере в штате Колорадо? Угроза чудовищного скандала… Что могло спасти его от скандала? Как ни странно, присутствие женщины, готовой сыграть роль жены преуспевающего политика… Кто идеально подходит на роль "жены незнакомца"? Молоденькая Лили Дейл, готовая на все, лишь бы вырваться из-за решетки… Это должно было стать смелой ложью – и неожиданно стало Великой любовью. Любовью страстной – и опасной…		
28355	Шелковые нити	(Райан Патриция)	Мужественный Грэм Фокс настроен весьма решительно — он окажет неоценимую услугу знатному барону и в награду получит в жены его дочь С богатым поместьем в придачу. И все бы хорошо, но Грэм не предполагал, что на его пути встретится прекрасная Джоанна. Очарованный ее умом и красотой, он разрывается между страстью и своими честолюбивыми планами. Сможет ли он пожертвовать блестящим будущим ради любви?..		
1556	Твои нежные руки	(Роджерс Розмари)	Рано осиротевшая юная американка Амелия Кортленд отправила а далекую Англию, надеясь найти утешение в доме своей крестной матери. Меньше всего ожидала Амелия обрести на берегах Туманного Альбиона пылкую, обжигающе-страстную любовь. Блестящий аристократ Холт Брекстон, граф Деверелл, по всеобщему мнению, способен принести Амелии лишь горе и боль. Но он готов поставить на карту собственную жизнь, чтобы подарить возлюбленной счастье…		
45122	Гленлионская невеста	(Рэнни Карен)	Из сборника "Избранницы любви"		
44689	Избранницы любви	(Сборники любовных романов)	Шотландские горцы. Могучие красавцы. Отчаянные воины. Пылкие возлюбленные… Так поется в балладах, а как на самом деле? Об этом мечтают узнать прелестные англичанки, которых капризная судьба однажды сводит с шотландцами. Четыре повести от королев исторического любовного романа. Четыре изумительные истории! Кристина Додд "Под шотландским пледом" Стефани Лоуренс "Роза в цвету" Джулия Куин "Гретна-Грин" Карен Рэнни "Гленлионская невеста"		
3644	Плененные сердца	(Сборники любовных романов)	Любовь не знает ни законов, ни границ. Любовь — смысл жизни всякого настоящего мужчины и всякой истинной женщины. На Диком Западе и в салонах лондонского света, на тропических островах и в идиллических сельских усадьбах — для любви есть место везде и всегда. Для любви страстной и нежной. Для любви властной и требовательной. Для любви такой, какой она предстает в новых повестях лучших авторов романтического жанра, покоривших сердца читательниц всего мира! Содержание: Мери Джо Патни "Безумный, безнравственный и опасный" Эдит Лейтон, "Клад" Мери Бэлоу "Распутник" Патриция Райс "Отцы и дочери" Джоан Вулф "Антагонисты"		
1667	Невольница любви	(Смолл Бертрис)	Деверелл Ли, много лет назад вынужденный бежать из Англии на далекий Восток, волею случая спас от жалкого жребия наложницы прекрасную Индию Линдли. Спас, не подозревая, что обрел свою единственную настоящую любовь, женщину, ставшую для него всем… Примечание: вторая книга в серии "Наследие Скай". Индия – правнучка Скай О`Малли.		
1799	Магия южной ночи	(Тернер Элизабет)	Сан-Доминго. Край роскоши и богатства, неистовых южных страстей и темных семейных тайн. Прелестная французская аристократка Кристина Бушар, вступив в "брак по доверенности" с богатым плантатором, приезжает на экзотический остров - и оказывается ввергнутой в ад цинизма и жестокости. Единственным лучом света в этой безрадостной жизни становится для Кристины любовь. Тайная, страстная, запретная любовь к Риду Александеру, настоящему мужчине, готовому на все, лишь бы спасти возлюбленную от уготованной ей горькой участи...		
1916	Моя навсегда	(Финч Кэрол)	Почему Иден, первая красавица Виргинии, отвергает самых блестящих поклонников и предпочитает семейным радостям унылую судьбу старой девы? Почему Себастьян, циничнейший из обольстителей виргинского высшего общества, внезапно понимает, что его презрение и недоверие к женщинам – чудовищная ошибка? И наконец – возможно ли, что рискованная политическая игра, в которую поневоле втянуты Иден и Себастьян, станет для них дорогой не к гибели, но – к обжигающему, великому счастью разделенной любви?…		
1922	Танцы, и не только	(Фокс Элайна)	Благосклонность к врагу-северянину может безвозвратно погубить репутацию девушки-южанки. Но прелестная Катра Мередит не думает о будущем, ибо в объятиях мужественного Райана Септ-Джеймса она познала подлинный рай страсти – страсти счастливой и прекрасной, чувственной и чистой, земной – и небесной. Рай страсти, что преодолевает своей неистовой силой ЛЮБЫЕ ПРЕГРАДЫ…		
1923	Упрямая девчонка	(Фокс Элайна)	Дерзкая и своенравная Мелисанда Сент-Клер поняла, что встретила мужчину своей мечты, в тот миг, когда впервые увидела Флинна Патрика. И пусть прошлое этого незнакомца покрыто тайной, пусть место, которое он занял в лондонском свете, принадлежит ему явно не по праву - какое это может иметь значение, если каждый обжигающий взгляд Флинна воспламеняет душу Мелисанды огнем любви и заставляет трепетать от страсти...		
1951	Валентинов день	(Фэйзер Джейн (Фэвэр))	Условия завещания были ясны: до своего замужества независимая леди Эмма Боумонт не может потратить ни пенса из наследства без одобрения лорда Аласдэра Чейза – человека, которого она покинула некогда у брачного алтаря. Упрямая красавица поклялась, что к Валентинову дню пойдет под венец хоть с самим дьяволом, и принялась искать супруга, еще не подозревая, что Аласдэр, по-прежнему страстно в нее влюбленный, твердо намерен этим супругом стать – и готов на все, лишь бы добиться взаимности…		
1972	Случайная невеста	(Фэйзер Джейн (Фэвэр))	Маркиз Кейто Гренвилл должен был жениться на старшей сестре юной Фиби Карлтон. Однако после смерти сестры Фиби пришлось занять ее место. Робкая мечтательная девушка не верила, что может быть достойна недосягаемого красавца, завладевшего ее грезами. Но любовь способна творить чудеса: наступает миг – и Кейто понимает, какое чудесное и бесценное сокровище подарила ему судьба…		
1998	Вкус ее губ	(Хауэлл Ханна)	Это - увлекательный рассказ о двух юных кузинах, пустившихся в долгий и опасный путь на Дикий Запад, и двух мужественных братьях-ковбоях, каждый из которых втайне мечтал найти женщину своей судьбы... Это - две истории любви. Истории очень разные - и равно прекрасные. Истории романтичные, увлекательные, чувственные и чистые.....		
7355	Обещание горца	(Хауэлл Ханна)	Эрик Мюррей. Младший из сыновей гордого шотландского лорда, имевший дерзновение прогневать своего отца - и на долгие годы изгнанный из клана. Жизнь его и без того полна трудностей - так зачем же принимать под защиту юную Бетию Драммонд с крошечным племянником? Возможно, истинный горец просто не в силах оставить в беде беспомощную девушку и ребенка. Или, может, причина столь безрассудного поступка в другом? Не честь и долг заставили Мюррея опекать Бетию - но пылкая страсть, что приходит к мужчине лишь однажды и становится смыслом его жизни...		
49794	Честь горца	(Хауэлл Ханна)	Юная леди Жизель бежала от мужа - жестокого и циничного лорда Дево. Однако в ночь ее побега Дево был убит - и вина падает на Жизель. В ее непричастность к убийству никто не верит. И единственный, кто готов прийти на помощь, - суровый шотландский горец Найджел Мюррей, волею судьбы спасший ее от преследователей. Найджел готов увезти Жизель в Шотландию, где она окажется в безопасности. Однако цена его помощи будет высока - не золото, не алмазы, а любовь.		
2038	Милая мятежница	(Холл Констанс)	Во времена великого короля Ричарда Львиное Сердце дамы были нежны и изящны - все, кроме леди Ларк, обладавшей гордой и отважной душой истинного воина и лихими манерами мальчишки-сорванца. Во времена великого короля Ричарда Львиное Сердце лорды были благородны и куртуазно-вежливы - все, кроме графа Блэкстоуна, сурового рыцаря, презиравшего любовь. Однако что за чувство с первой встречи вспыхнуло между девушкой, не терпевшей над собой ничьей власти, и воителем, привыкшим считать женщин жалкими игрушками? Ненависть - или безумная страсть...		
2157	Украденные чары	(Эшуорт Адель (Эшворт))	Романтичная Натали Хейслет, отвергавшая богатых и знатных поклонников, упорно мечтала о встрече с самим Черным рыцарем, легендарным разбойником-джентльменом, о чьей отваге и мужестве ходили легенды! Но может быть, судьба уже свела девушку и Черного рыцаря? Может быть, благородный разбойник, скрывающийся под маской светского льва, уже подарил Натали свое сердце - и теперь завлекает ее в сети опасности и страсти...		
2161	Цветы подо льдом	(Юинг Джин Росс)	Она была невинна, как только что распустившийся в шотландских горах цветок. Он был холоден и жесток, как лед, что сковывает английские реки. Однако политические интриги наполеоновских войн соединили судьбы бесстрашного англичанина Доминика Уиндхэма и юной шотландской аристократки Кэтрионы Синклер пламенной нитью величайшего на свете искушения - искушения Любовью. Ибо нет настоящего мужчины, что втайне не мечтал бы душою и телом подчиниться силе страсти, - как нет истинной женщины, которая не надеялась бы обрести счастье в сильных объятиях возлюбленного. ...		
96	Наконец-то!	(Басби Ширли)	Чем может помочь юному беспутному брату старшая сестра, заменившая ему мать? Только – оплатить его карточные "долги чести". Любой ценой. Даже ценой возвращения к бывшему жениху, который когда-то жестоко обманул ее доверчивую, чистую первую любовь... Однако теперь красавица Арабелла Монтгомери не намерена доверять ни сладким словам, ни жарким объятиям отчаянного, легкомысленного Тони Даггета. Что же предпримет Тони, желая доказать бывшей невесте искренность своей любви?..		
101	Только ради любви	(Басби Ширли)	Только по любви готова молоденькая вдова Софи Марлоу, познавшая все ужасы безрадостного брака по расчету, пойти под венец вновь... Только во имя мести готов циничный любимец женщин виконт Айвес Харрингтон расстаться с беспутной холостяцкой жизнью... Только во спасение от верной гибели обменялись эти двое брачными обетами – и под прикрытием фиктивного брака окунулись в водоворот опасных интриг. Но... однажды холодная игра превращается в реальность. В реальность настоящей любви – чувственной, нежной, всепоглощающей. Ибо только любовь может подарить Софи и Айвесу счастье...		
2360	Безрассудный (Безрассудная любовь)	(Брокуэй Конни)	Он был безрассуден настолько, насколько может быть безрассуден прирожденный искатель приключений... Он вырвался из тюрьмы чудом – чудом, что совершила загадочная красавица с лицом ангела и душой предательницы... Он снова отправился навстречу своей судьбе – на поиски таинственного старинного сокровища. Однако он еще не знал, что самым большим сокровищем его жизни станет любовь – страстная любовь к женщине, которую, казалось бы, ему надо ненавидеть всем сердцем...		
210	Неотразимая (Несравненная)	(Брокуэй Конни)	Кому подарит свое сердце первая красавица Лондона – Фиа Меррик, славящаяся своей ироничной неприступностью? Кому суждено догадаться, что под маской блестящей светской львицы, отвергающей одного поклонника за другим, скрывается невинная девушка, мечтающая найти мужчину своей мечты?.. Возможно, только шотландскому лорду Томасу Макларену, "дикому горцу", который дерзнул увезти Фиа к себе в замок и ни на миг не переставал бороться за ее доверие и любовь.		
2351	В плену любви	(Брэдли Шелли)	Кто знает, как рождается любовь в душе мужчины и женщины, которые должны бы ненавидеть и презирать друг друга? Кто знает, в какой миг запылает жгучая страсть в сердце объявленного вне закона шотландского горца Дрейка Макдугала и прекрасной, как ангел, леди Эверил Кэмпбелл? Кто знает, когда влюбленные поймут, что никакая опасность, никакое зло не в силах помешать им обрести счастье в объятиях друг друга…		
