2383	Мелодия души	(Бэлоу Мэри)	Когда-то она была для него спасением. Глухонемая Эмили Марлоу, безмолвно взирала на него своими огромными глазами и слушала, слушала, слушала… Она знала все его тайны, все его мечты и надежды, с ней он находил свой покой. Этот маленький олененок, единственный из всех не считал его – Эшли Кендрика, второго сына герцога, никчемным и беспутным прожигателем жизни. Но его ждало будущее – светлое и прекрасное будущее, и он уехал от нее в Индию, чтобы навек забыть о прошлом и зажить новой жизнью. Но прошли годы, страшные и тяжелые годы и он был вынужден вернуться…		
3486	Сегодня или никогда	(Джой Дэйра)	Хлоя Харт была влюблена в виконта Секстона с шестилетнего возраста. Все это время она терпеливо ждала взросления и обдумывала план покорения лучшего мужчины в своей жизни. Джон Секстон и не подозревал о сих матримониальных планах. Он совершенствовался в искусстве обольщения и заслуженно завоевал титул лорда Страсти. Но вот время пришло…		
2975	Жди меня	(Камерон Стелла)	Много воды утекло с тех пор, как шотландец Грей Фэлконер отправился в чужие края, пообещав своей невесте Минерве Арбакл вернуться, - и все эти годы девушка преданно ждала возлюбленного. Однажды он действительно вернулся, чтобы вновь сделать ее счастливой и вновь принести ей дар подлинной, жгучей страсти. Однако коварные враги, желая любой ценой разлучить влюбленных, готовы исполнить свои планы даже ценой преступления, и теперь Грею и Минерве предстоит вступить в отчаянную схватку со злом...		
3109	Ярче солнца	(Куин Джулия)	Прекрасно, когда любовь словно падает с неба. Прекрасно, когда любовь приходит нежданно. Но... Поначалу о любви между Элинор Линдон и скандальным великосветским ловеласом Чарлзом Уикомом, графом Биллингтоном, речи не шло. Обсуждались сухие условия фиктивного брака-сделки, весьма выгодного для обоих партнеров. Однако долго ли останется фиктивным брак, в котором мужчина и женщина буквально из последних сил сдерживают жгучую, непреодолимую страсть друг к другу?...		
1153	Контрабандистка	(Лоуренс Стефани)	Юная контрабандистка, не признающая над собой ничьей власти, – такова Кит Кранмер. Отважный, не знающий страха воин, чья шпага наводит ужас на врагов, обольститель, о котором мечтают первые красавицы побережья Англии, – таков капитан Джек. Эти двое повстречались в Час ночи. Час битвы. Час опасности. Они должны были возненавидеть друг друга, однако ненависть их быстро обратилась в любовь – пламенную, неистовую, земную.		
1946	Алмазный башмачок	(Фэйзер Джейн (Фэвэр))	Юная аристократка Корделия Бранденбург рано лишилась родителей. Дядя девушки, воспитанной при дворе австрийской императрицы, устраивает ее брак с пожилым прусским князем. Венчание совершается "по доверенности" – вместо незнакомого мужа у алтаря рядом стоит великолепный молодой виконт Лео Бомонт. И внезапно красавица осознает, что не мыслит своей жизни без Лео…		
2549	Дикарь	(Хармон Данелла)	Несчастья неустанно преследовали прекрасную Джульет Пейдж – она потеряла жениха Чарльза, ее отвергло его знатное чопорное семейство. Но внезапно вспыхнувшее чувство между ней и благородным Гаретом, братом Чарльза, возрождает красавицу к новой жизни. Юная Джульет становится ангелом милосердия и смыслом жизни для отважного героя…		
7	Спящая красавица	(Айвори Джудит)	У ног сэра Джеймса Стокера, бесстрашного и неотразимого искателя приключений, лежал весь лондонский свет. Любая из прекрасных "львиц" высшего общества с удовольствием стала бы его возлюбленной - но он, не желавший легких побед, возжелал покорить сердце неприступной Николь Уайлд, женщины, которая имела все основания не доверять мужчинам. Однако чем яростнее сопротивлялась Николь чарам настойчивого поклонника, тем отчаяннее стремился Джеймс любой ценой пробудить "спящую красавицу" для новой жизни, полной страсти и счастья…		
2228	Колдовство	(Беверли Джо)	Беда обрушилась на юную Мэг Джиллингем в канун Рождества. Ее семья могла лишиться крова, и существовал, казалось бы, один способ избежать этого – сделать сестру Мэг, красавицу Лору, любовницей немолодого богача-сластолюбца. Мэг оставалось только уповать на чудо. Но ведь Рождество – время чудес. Благородный и смелый граф Саксонхерст становится для Мэг не только надежным защитником, но и дарит ей заслуженное счастье – счастье прекрасной и пылкой любви...		
105	Лорд полуночи	(Беверли Джо)	Лорд Саммербун трагически погиб, и некому было бы защитить от могущественных недугов его дочь, прекрасную леди Клэр, не приди ей на помощь могучий рыцарь Ренальд де Лисл. Воином вошел он в ворота замка, страстным возлюбленным и нежным мужем стал для Клэр. Но недолгим оказалось счатье влюбленных, ибо страшная тайна, скрытая в прошлом Ренальда, угрожает молодым супругам, и им предстоит сражаться за свою любовь...		
2361	Мой милый враг (Любимый враг)	(Брокуэй Конни)	Истории великой любви начинаются по-разному. Иногда – с забавной переписки, которую ведут знаменитый авантюрист Эйвери Торн и очаровательная, независимая Лилиан Бид. Истории великой любви бывают разными. Эта – любовь-вражда, любовь – ироничный поединок мужчины, уверенного, что устоит перед чарами любой женщины, и женщины, убежденной, что любовь – всего лишь ловушка, придуманная мужчинами. И все же истории великой любви всегда имеют что-то общее. Возможно, их объединяет сила чувства, притягивающего двух людей друг к другу...		
6588	Во власти желания	(Камерон Стелла)	Аристократ Макс Россмара и дочь бедного фермера Керсти Мерсер в детстве были неразлучны. Повзрослев, Макс едет в Лондон.Проходит много лет, и, пресыщенный жизнью в высшем свете, он возвращается в свое поместье. Что сулит ему новая встреча с Керсти? Сумеет ли блестящий повеса покорить сердце неприступной красавицы? Сможет ли детская дружба превратиться в безумную, страстную любовь?		
996	В погоне за наследницей	(Куин Джулия)	Кто похитил юную, своевольную и язвительную наследницу старинного аристократического рода? Конечно, красавец с нелегкой профессией секретного агента разведки! А кто влюбился в прекрасную пленницу, которую по ошибке принял за известную шпионку? Конечно, он же! Но – что ждет героев столь безумного романа? Обжигающая сила страсти? Разумеется! Сумасшедший, нежный и смешной карнавал сомнений и приключений? Безусловно! И – любовь.		
3224	Грешные обещания	(Мартин Кэт)	Гордая Элизабет Вулкот не ожидала от уготованного ей брака по расчету ничего, кроме горя, и лишь полное отчаяние могло заставить девушку молить о помощи графа Николаса Уорринга, считавшегося самым коварным соблазнителем Лондона и, возможно, даже жестоким преступником. Однако спасение от ужасного венчания оборачивается для Элизабет опасностью новой – забыв о светских условностях, чести и долге, отдаться на волю сладостной и грешной любви Николаса и познать в его объятиях истинную силу разделенной страсти и подлинного счастья…		
2959	Леди и сокольничий	(О`Доннел Лорен)	Солейс Фариндейл сразу обратила внимание на нового обитателя отцовского замка - высокого и красивого сокольничего, и была готова подарить ему свою любовь, позабыв об осторожности. Нежная, наивная Солейс! Логан Грей - ее заклятый враг, он намерен убить отца девушки и завладеть замком.		
2920	Моя нежная фея	(Патни Мэри Джо)	О странностях юной леди Мэриан Грэм ходили легенды столь невероятные и пугающие, что ее называли безумной. Однако, встретившись с Мэриан, молодой Доминик Ренбурн с изумлением увидел вместо капризной сумасбродки тихую, молчаливую красавицу, которую невозможно не полюбить всем сердцем, не пожелать душой и телом. Каково же было изнемогающему от любви Доминику постоянно помнить о том, что рано или поздно он должен отдать возлюбленную в жены своему брату?		
2763	Ее тайная связь	(Смит Барбара Доусон)	Во имя тайной благородной цели красавица Изабелла Дарлинг была готова на все. Не задумываясь бросила она вызов самому неукротимому и гордому мужчине Англии – графу Джастину Керну. Однако слишком быстро война между Изабеллой и Джастином обратилась в неистовую страсть. Страсть-поединок. Страсть-мучение. Страсть, которая может ввергнуть влюбленных в смертельную опасность – или подарить им счастье…		
38110	Песня реки	(Томасон Синтия)	Мошенник-антрепренер решил заработать на гастролях Анны Роуз Конолли довольно необычным способом — пустил слух, что молоденькая певица... слепа. И хитрый план сработал. Лишь сероглазый красавец Филип Бришар не поверил ложному слуху, и этот обман его только рассмешил. Но неожиданно Анна Роуз оказывается в смертельной опасности и молит его о спасении. Какой же джентльмен не рискнет жизнью ради беззащитной дамы! Особенно — если дама эта покорила его сердце и зажгла в нем пламя страстной, неодолимой любви…		
2697	Невеста дракона	(Филлипс Патриция)	Гордая красавица Изабель де Лейси после смерти отца попала под опеку сводного брата, тщеславного и никчемного рыцаря. И он проиграл ее на турнире мужественному воину Моргану Нельсу, по прозвищу Дракон. Морган влюбился в прекрасную Изабель с первого взгляда и увез с собой, чтобы жениться и жить вместе с ней в родовом замке, а красавица, оценив его благородство и верность, стала его возлюбленной и другом. Вместе они сумели противостоять коварству и предательству жадных врагов.		
2727	Изумрудный лебедь	(Фэйзер Джейн (Фэвэр))	Граф Гарет Харкорт случайно увидел представление бродячего цирка и был потрясен поразительным сходством юной акробатки Миранды с прекрасной леди Мод, которую он безуспешно пытался убедить выйти замуж за самого короля Франции. Дерзкий план созрел немедленно – граф предложил безродной циркачке сыграть роль знатной дамы и занять место Мод у алтаря. Однако он не принял в расчет того, что сам может влюбиться в Миранду, а она – со всем пылом первой любви ответить на его чувства…		
1977	Храбрая леди	(Хадсон Джен)	Красавица Энн не была храброй от природы. Но она была честной - честной настолько, что решилась бесстрашно выступить против мужа-мошенника... Но - даже очень храброй молодой леди не выиграть схватки с отпетым негодяем, если за спиной ее не будет стоять настоящий мужчина, защитник, не знающий ни страха, ни сомнений. Такой, как отчаянный Уэбб Маккуиллан, не просто страстно полюбивший Энн, но готовый ради счастья любимой рискнуть собственной жизнью...		
2025	Талисман	(Хенли Вирджиния)	Прекрасная шотландка Джейн Лесли с детства лелеяла в душе два чувства – ненависть к захватчикам-англичанам и надежду на встречу с таинственным, магически притягательным воином, явившимся ей в видении. И однажды видение обрело плоть и имя, но судьба уготовила девушке серьезное испытание. Ибо Линкс де Уорен, полюбить которого Джейн было предначертано свыше, оказался одним из проклятых кельтами английских рыцарей. Однако ненависть и вражда бессильны перед лицом истинной любви, страстной и обжигающей, превосходящей волю и разум…		
5268	Иллюзия	(Юинг Джин Росс)	Для Фрэнсис Вудард, золотоволосой куртизанки, страсть была искусством, в совершенстве изученным на далеком Востоке. Лишь встретив удивительного человека - аристократа и авантюриста Найджела Арундэма, Фрэнсис поняла, что бурная страсть не может существовать без подлинной любви, которая способна помочь двум незаурядным людям преодолеть все опасности и невзгоды и обрести долгожданное счастье...		
2178	Право первой ночи	(Айвори Джудит)	Кто мог взяться за сложнейшее дело – в короткий срок превратить "грубого дикаря" Мика Тремора в благовоспитанного, безупречного джентльмена? Только эксцентричная леди Эдвина Боллаш. всем известная старая дева лондонского света! Что должно было выйти из такого партнерства? На первый взгляд – ничего хорошего! Не сразу, далеко не сразу удалось Эдвине разглядеть в вульгарном простолюдине истинного аристократа и настоящего мужчину – сильного, благородного, бесстрашного. Не сразу и Мик увидел в "унылой" учительнице нежную, страстную, прелестную женщину. Не сразу осознали эти двое, что связаны не жесткими условиями договора, но огненными узами любви…		
2180	Брачный контракт	(Александер Виктория)	Беспутный Максимилиан Уэллс, граф Трент, отчаянно нуждался в достойной невесте, не только обладающей крупным состоянием, но и способной придать своей красотой и остроумием должный блеск его титулу. Прекрасная как богиня Пандора Эффингтон казалась поистине идеальным выбором – с одним небольшим "но". Условие, которое она поставила Максимилиану, нелепое и забавное, исполнить было нелегко. Прежде чем повести красавицу к алтарю, он должен был... доказать подлинность своих чувств. Как?! А вот это взбешенному жениху, сгорающему в пламени страсти, решать самому...		
2226	Тайны ночи	(Беверли Джо)	Престарелый граф не обладает, увы, способностью зачать наследника, а его юная супруга должна стать матерью любой ценой. Так начинается история невероятного приключения... Однако предполагаемый "кандидат в отцы наследника" блестящий лорд Бренд Маллорен отнюдь не горит желанием упасть в объятия незнакомой красавицы, а прелестная леди Розамунда Овертон совершенно не готова ни к ошеломительной любви, ни к забавной "войне интересов" с самым дерзким и необузданным из британских аристократов...		
529	Его грешные пути	(Джеймс Саманта)	Многие женщины любили бесстрашного Камерона Маккея и мечтали пойти с ним под венец... но отважный шотландский горец поклялся взять в жены ту единственную, которая смертельно его ненавидела. Именно гордая Мередит, дочь предводителя враждебного Маккеям клана, должна стать матерью ребенка, который положит конец ненависти между двумя семьями. Однако — чтобы покорить сердце Мередит, Камерону понадобится принести величайшую жертву, на какую только способен мужчина. Всего-то — ПО-НАСТОЯЩЕМУ полюбить женщину. Всего-то — принадлежать ей так же, как она будет принадлежать ему.		
483	Символ любви	(Д`Алессандро Джеки)	Хейли Олбрайт совершенно не похожа на остальных женщин, - это сразу понял Стивен Александр Барретсон, маркиз Гленфилд. Ночью не побоялась разыскать раненого в лесу, привезла домой и выходила незнакомца, - с таким бесстрашием и таким хладнокровным пренебрежением условностями Стивен сталкивался впервые. Маркиз, чудом спасшийся от наемных убийц, скрыл свое настоящее имя и назвался простым учителем, но был с распростертыми объятиями принят всем огромным эксцентричным семейством Хейли, и сама чудесная девушка отдала свое сердце зеленоглазому красавцу. Но циничному и холодному Гленфилду трудно поверить, что существует такая чистота, такая искренность, такая любовь…		
